{
  "schema_version": "2.0",
  "generated_at": "2025-12-07T00:00:00Z",
  "description": "Extended allowlist for F7-LAS with governance, context control, and policy enforcement metadata.",
  "tools": [
    {
      "id": "siem_query",
      "display_name": "SIEM Query",
      "owner": "Security Operations",
      "risk_tier": "medium",
      "permissions": ["read"],
      "allowed_versions": ["1.*"],
      "description": "Read-only log and incident queries.",
      "status": "active",
      "last_reviewed": "2025-01-01",

      "approved_roles": ["soc_analyst", "audit_viewer"],
      "execution_context": "sandboxed",
      "compliance_flags": ["logs_pii"],
      "tool_category": "logging",
      "review_metadata": {
        "reviewed_by": "sec_team@example.com",
        "review_notes": "Reviewed for log access patterns and PII handling."
      },
      "discovery_behavior": {
        "dynamic": false,
        "requires_approval_on_discovery": false
      },
      "enforcement_policy": {
        "fail_behavior": "deny",
        "requires_hitl": false
      }
    },
    {
      "id": "ticket_create",
      "display_name": "Ticket Create",
      "owner": "SOC Workflow",
      "risk_tier": "medium",
      "permissions": ["create"],
      "allowed_versions": ["1.*"],
      "description": "Create new SOC or service tickets.",
      "status": "active",
      "last_reviewed": "2025-01-01",

      "approved_roles": ["soc_analyst", "incident_responder"],
      "execution_context": "sandboxed",
      "compliance_flags": [],
      "tool_category": "workflow",
      "review_metadata": {
        "reviewed_by": "alice@example.com",
        "review_notes": "No sensitive data; verified scoped usage."
      },
      "discovery_behavior": {
        "dynamic": true,
        "requires_approval_on_discovery": true
      },
      "enforcement_policy": {
        "fail_behavior": "deny",
        "requires_hitl": false
      }
    },
    {
      "id": "prod_kv_write",
      "display_name": "Production HSA Vault Write",
      "owner": "Platform Security",
      "risk_tier": "high",
      "permissions": ["write-privileged"],
      "allowed_versions": ["1.*"],
      "description": "Write secrets to production key vaults.",
      "status": "restricted",
      "last_reviewed": "2025-01-01",

      "approved_roles": ["platform_engineer"],
      "execution_context": "remote-control-surface",
      "compliance_flags": ["accesses_credentials"],
      "tool_category": "secrets",
      "review_metadata": {
        "reviewed_by": "lead_sec_eng@example.com",
        "review_notes": "Requires strict vault controls; privileged access only."
      },
      "discovery_behavior": {
        "dynamic": false,
        "requires_approval_on_discovery": false
      },
      "enforcement_policy": {
        "fail_behavior": "deny",
        "requires_hitl": true
      }
    }
  ]
}
